{"authorization":"RESEARCH_ONLY_NOT_SHADOW_PAPER_OR_LIVE","dataset":{"canonical_sha256":"e436a5a2b093365886464dd3e471cc5cd55c54bd2c06ceaa898ac218c45436dd","rows":52608},"document_type":"DRA_DECLARATIVE_ENTRY_ADMISSION_MANIFEST_V1","economics":{"fee_rate":"0.0010","initial_equity_usdt":"250","slippage_rate":"0.0005","slot_capacity_usdt":"240"},"experiment_id":"dra-directional-volume-participation-entry-admission-v1","feature":{"decision_time":"LATEST_COMPLETE_UTC_DAY_BEFORE_NEXT_BAR_FILL","key":"DAILY_POSITIVE_RETURN_QUOTE_VOLUME_SHARE_TO_PRIOR_20D_MEDIAN","lookback_complete_days":20,"relation":"AT_OR_ABOVE"},"gate_set":"DRA_DECLARATIVE_ENTRY_ADMISSION_GATES_V1","oos_access":"DENY","parent_strategy":"BTC_DRA_V1","prior_evidence":{"disposition":"PRIOR_SUPPORTS_ONE_DIRECTIONAL_VOLUME_PARTICIPATION_ADMISSION_AUDIT","path":"research_pipeline/examples/dra-directional-volume-participation-primary-prior.v1.json","sha256":"2bf47009c6fcf436c2cf225116d934fa8e46ee92a223f6c5c9f6e7e35386954d"},"schema_version":"1","selection_cutoff":"2025-01-01T00:00:00","variants":[{"role":"lower_neighbor","threshold":"0.8","variant_id":"directional-volume-participation-admission-0_8-v1"},{"role":"primary","threshold":"1.0","variant_id":"directional-volume-participation-admission-1_0-v1"},{"role":"upper_neighbor","threshold":"1.2","variant_id":"directional-volume-participation-admission-1_2-v1"}]}
