{"authorization":"RESEARCH_ONLY_NOT_SHADOW_PAPER_OR_LIVE","dataset":{"canonical_sha256":"e436a5a2b093365886464dd3e471cc5cd55c54bd2c06ceaa898ac218c45436dd","rows":52608},"document_type":"DRA_DECLARATIVE_ENTRY_ADMISSION_MANIFEST_V1","economics":{"fee_rate":"0.0010","initial_equity_usdt":"250","slippage_rate":"0.0005","slot_capacity_usdt":"240"},"experiment_id":"dra-bipower-jumpiness-entry-admission-v1","feature":{"decision_time":"LATEST_COMPLETE_UTC_DAY_BEFORE_NEXT_BAR_FILL","key":"DAILY_REALIZED_TO_BIPOWER_VARIATION_RATIO_TO_PRIOR_20D_MEDIAN","lookback_complete_days":20,"relation":"AT_OR_BELOW"},"gate_set":"DRA_DECLARATIVE_ENTRY_ADMISSION_GATES_V1","oos_access":"DENY","parent_strategy":"BTC_DRA_V1","prior_evidence":{"disposition":"PRIOR_SUPPORTS_ONE_BIPOWER_JUMPINESS_ADMISSION_AUDIT","path":"research_pipeline/examples/dra-bipower-jumpiness-primary-prior.v1.json","sha256":"f39e5aaebb27e088e4fdbee1e48e21c89c55553b264f8025a23b1e0cff7d00cd"},"schema_version":"1","selection_cutoff":"2025-01-01T00:00:00","variants":[{"role":"lower_neighbor","threshold":"0.8","variant_id":"bipower-jumpiness-admission-0_8-v1"},{"role":"primary","threshold":"1.0","variant_id":"bipower-jumpiness-admission-1_0-v1"},{"role":"upper_neighbor","threshold":"1.2","variant_id":"bipower-jumpiness-admission-1_2-v1"}]}
